trial,idea,status,expected_alpha_dollars,impact_cost_dollars,linear_cost_dollars,expected_net_pnl_dollars,pnl_vol_dollars,loss_var_95_dollars,loss_cvar_95_dollars,probability_profitable,daily_gross_spearman,late_early_gross_ratio,completion_day5_pct,nondecreasing_transitions,urgent_first_trade_day,medium_first_trade_day,small_first_trade_day,early_factor_imbalance_pct,scenario_mean_pnl_dollars,scenario_pnl_std_dollars,scenario_p05_pnl_dollars,scenario_median_pnl_dollars,scenario_p95_pnl_dollars,scenario_probability_profitable,scenario_loss_var_95_dollars,scenario_loss_cvar_95_dollars,scenario_loss_cvar_95_mean_dollars,scenario_loss_cvar_95_std_dollars,scenario_loss_cvar_95_worst_dollars,decision
profile_high,Select the highest expected net P&L inside the desk risk budget.,optimal,1034511.5368068817,340372.5864024607,49047.59677026302,645091.3536341579,3781285.6384267183,5914211.054438742,8379277.976513487,0.59375,0.49090909090909085,1.7164696525650829,43.3252170335811,6.0,1.0,1.0,10.0,5.469779548506524,645091.3536341576,4122449.021808272,-6278415.017988457,814379.9819075989,7029362.409916487,0.5852,6292584.460946187,8576433.95141452,8409097.854036517,151313.49979430166,8576433.95141452,keep
profile_medium,Select the highest expected net P&L inside the desk risk budget.,optimal,1107077.699350989,306860.022807344,49742.44817817834,750475.2283654667,3991730.5182039547,5914697.255283639,8852519.339315655,0.59765625,-0.04242424242424241,0.9959992127827041,49.199698830823706,5.0,1.0,1.0,1.0,3.8340010911567495,750475.2283654663,4383272.784092819,-6643325.006661389,950136.780350013,7673372.4798114905,0.5932,6665884.705624847,9092726.486012066,8912428.155050661,164815.51367790526,9092726.486012066,keep
profile_low,Select the highest expected net P&L inside the desk risk budget.,optimal,1201659.0573873327,334204.1070050274,50472.36104252336,816982.5893397819,4523218.087999987,6562939.042690729,9678819.831323752,0.59765625,-0.4545454545454545,0.5109208525262101,58.740995494502556,4.0,1.0,1.0,1.0,8.46150383815152,816982.5893397818,4940578.137577189,-7682520.121243203,1022867.3186338535,8560191.06875847,0.5858,7687743.063058398,10236075.8561243,10008481.026192173,222135.4268601975,10236075.8561243,keep
cvar_profile_high,Penalize worst-tail path P&L using centered fat-tail event scenarios.,optimal,980529.1231930698,384944.64240767324,48920.21790709294,546664.2628783036,4046632.5450890693,5609943.271829113,7755000.127633163,0.57421875,0.8424242424242423,1.8524159716244224,42.17614609031914,6.0,1.0,1.0,9.0,27.12290817516795,546664.2628783038,4335799.723859605,-6787565.677582343,668101.1485432616,7385755.26608641,0.5626,6789152.388753523,9100973.774985544,8856456.881624881,251444.86459146673,9120125.97087153,discard
cvar_profile_medium,Penalize worst-tail path P&L using centered fat-tail event scenarios.,optimal,1106525.582117719,323353.9474391765,49752.11838166131,733419.5162968813,4150247.6001799977,5549576.660514395,8441619.993430836,0.57421875,-0.10303030303030303,0.9590872143068868,50.28923126006765,6.0,1.0,1.0,1.0,23.447741002443124,733419.5162968814,4525936.936276788,-6899042.046749881,934025.8071478043,7873255.986499478,0.5868,6915239.4098445205,9401149.23493692,9181844.468293235,213452.7454107652,9401149.23493692,discard
cvar_profile_low,Penalize worst-tail path P&L using centered fat-tail event scenarios.,optimal,1210303.927425657,339462.968543519,50548.798288161095,820292.1605939768,4646161.341714053,6239131.115952908,9580830.687123701,0.609375,-0.4787878787878787,0.4816731404248701,59.6222154855441,4.0,1.0,1.0,1.0,13.096500356807965,820292.1605939765,5060721.1011991585,-7822731.182033795,995135.9749712247,8790300.801573338,0.5852,7844295.680486281,10462488.01577441,10228198.650230467,250918.6854753621,10499783.125413612,discard
hybrid_profile_high,Automatically price covariance risk plus only the excess scenario tail.,optimal,1032246.4353563727,340386.63239308883,49036.380706426935,642823.4222568569,3782760.09477156,5695592.592823582,8288956.805372133,0.58984375,0.5030303030303029,1.7072272862595117,43.60232447984164,6.0,1.0,1.0,10.0,5.810622812669433,642823.4222568566,4123082.0605246825,-6265987.286850135,829418.9673653311,7079703.75786499,0.5846,6268627.043484865,8582201.39902753,8409655.91108908,150760.22786584997,8582201.39902753,discard
hybrid_profile_medium,Automatically price covariance risk plus only the excess scenario tail.,optimal,1068466.0517047686,309070.86469373165,49378.08413991664,710017.1028711202,3862262.361803889,5842290.083461652,8532887.628237147,0.59375,0.49090909090909085,1.346942717560316,45.18647410392358,6.0,1.0,1.0,4.0,3.224919454513425,710017.1028711202,4228792.051639713,-6374748.724296952,893725.2666283951,7325541.5864039315,0.5902,6409930.853808912,8787052.247299869,8603830.475887405,157067.31134470605,8787052.247299869,keep
hybrid_profile_low,Automatically price covariance risk plus only the excess scenario tail.,optimal,1199457.0236753402,333068.49146524986,50453.94350807757,815934.5887020129,4509083.549232159,6520135.923059593,9642097.27824429,0.59765625,-0.4545454545454545,0.520523781540182,58.49999735563056,4.0,1.0,1.0,1.0,8.201059501969196,815934.5887020128,4926277.380854031,-7672403.637842487,1019531.7866816904,8543467.865235558,0.586,7692463.963705797,10206302.250146408,9978953.021280456,221438.3825815792,10206302.250146408,keep
tail_second_profile_low,Price the excess tail with its conditional second moment instead of CVaR slacks.,optimal,1198670.8773417324,332766.89330795343,50446.330515695234,815457.6535180837,4502684.94938869,6522845.328201155,9636679.608460467,0.6015625,-0.406060606060606,0.5243049547438342,58.411984324516446,4.0,1.0,1.0,1.0,8.070822390804928,815457.6535180836,4919890.77623997,-7650375.192010364,1020585.8996455071,8535039.612420566,0.5866,7659469.4367514495,10192983.373767948,9966604.62777234,220779.7967711994,10192983.373767948,keep
medium_scalar_tca,Ablate date-by-name TCA and solve with target-weighted basket medians.,optimal,1123585.386896622,311821.3023894349,49962.62784925525,761801.4566579318,4067154.91410903,6096264.48154403,8972967.014304461,0.59375,-0.2727272727272727,0.8182320999103536,52.031857953594105,5.0,1.0,1.0,1.0,3.5243283660146245,761801.4566579313,4467161.320442573,-6760814.288086848,970866.4862089346,7802484.248019562,0.5908,6769813.685132881,9270349.592426619,9080926.627936361,166088.66896880415,9270349.592426619,discard
reference_fixed_weight_no_alpha,Use the prior fixed synthetic coefficient without an alpha forecast.,optimal,1033660.064050602,356469.3772673977,48994.05530633821,628196.6314768661,3780098.9833304286,5971900.066968518,8391336.219053572,0.59375,0.406060606060606,1.7311734395163612,43.238226820555795,5.0,2.0,2.0,10.0,5.515438003154006,628196.631476866,4121829.1784936595,-6253446.878074708,798096.3419707284,7024023.400474001,0.5834,6276437.623454778,8591830.304590663,8421929.985210765,152097.86343105402,8591830.304590663,baseline_only
medium_weight_no_alpha,Ablate expected rebalance alpha at the medium calibrated risk weight.,optimal,1005439.6220099154,293907.3539316875,49005.42205101749,662526.8460272105,3851662.511640684,5675163.970867354,8346251.477481311,0.578125,0.9636363636363635,1.7023336307174344,41.58047291484423,8.0,1.0,1.0,8.0,6.2527659554360895,662526.8460272105,4171959.299608376,-6353675.992659027,835160.2977298681,7172120.059566503,0.5852,6356737.244898575,8669899.244740669,8464618.286647184,183201.00903561516,8669899.244740669,discard
medium_weight_no_factor,"Ablate country, sector, and industry covariance at the medium risk weight.",optimal,1159077.866895077,311454.57917224825,50083.76021891374,797539.527503915,4448574.6901535755,6345562.137834343,9307517.473146271,0.59765625,-0.13939393939393938,0.7812568068879425,52.76494283885394,5.0,1.0,1.0,1.0,14.30197449632356,797539.5275039148,4836227.401174865,-7412282.042718577,992305.7239186108,8387026.1821701,0.5852,7423152.168770236,9994662.576285,9769374.651490605,216864.38288908408,9994662.576285,discard
hybrid_medium_cov1_cvar0.1,Add a scaled downside-CVaR overlay while retaining covariance factor risk.,optimal,1103199.2907484681,305785.7675030592,49705.61851988475,747707.9047255241,3980541.2715728725,5859835.936903434,8770493.020480804,0.59375,-0.04242424242424241,1.0297780109693182,48.68930895696018,5.0,1.0,1.0,1.0,4.1272440792056,747707.9047255239,4369179.757404704,-6653395.818609023,959784.8638599954,7626635.708692191,0.592,6659621.270553196,9063297.162766198,8883650.024181377,164033.85276187467,9063297.162766198,keep
hybrid_medium_cov1_cvar0.3,Add a scaled downside-CVaR overlay while retaining covariance factor risk.,optimal,1093088.0990068228,304952.60326582496,49617.0508783893,738518.4448626086,3952953.8335638586,5788979.533132629,8580351.703541346,0.59375,0.2727272727272727,1.106814402117047,47.562694179018266,5.0,1.0,1.0,1.0,6.244906990845133,738518.4448626081,4333768.061125263,-6615506.246155567,975552.8262485481,7538287.607844341,0.5904,6619364.3165807575,8993939.43951962,8813214.279527573,161921.3766347355,8993939.43951962,discard
hybrid_medium_cov1_cvar1,Add a scaled downside-CVaR overlay while retaining covariance factor risk.,optimal,1061687.3428117586,311761.9371785006,49395.93262169183,700529.4730115662,3898882.5918420567,5588070.208417638,8100308.44522272,0.58203125,0.6242424242424242,1.2809734974827902,45.50110573729343,6.0,1.0,1.0,1.0,12.929440404877031,700529.4730115661,4253658.888839083,-6523104.694786052,902749.0031349118,7291649.551693103,0.5876,6525485.120934716,8832304.656061513,8658056.20116423,158992.53329217757,8832304.656061513,discard
hybrid_medium_cov1.5_cvar0.3,Add a scaled downside-CVaR overlay while retaining covariance factor risk.,optimal,1075132.9316207794,306593.6561986636,49447.48476201969,719091.7906600961,3889625.983030393,5786805.954414971,8468424.690197915,0.58984375,0.5030303030303029,1.2697877136354359,45.762666610237986,7.0,1.0,1.0,1.0,5.455477799214278,719091.7906600958,4259234.573438098,-6466199.973927204,928877.0491671816,7407588.9050974855,0.5906,6490042.54931094,8846051.138288515,8664374.326457836,158448.9381279171,8846051.138288515,discard
hybrid_medium_cov2_cvar0.3,Add a scaled downside-CVaR overlay while retaining covariance factor risk.,optimal,1061691.9018618707,309631.5168291258,49335.96368190873,702724.421350836,3849910.851677431,5770287.5621983465,8399575.76914529,0.59375,0.5636363636363636,1.3875421236450947,44.790135567115584,6.0,1.0,1.0,1.0,5.2255483432452055,702724.4213508359,4209918.646003729,-6383277.445898541,896697.9547751042,7292186.12031258,0.5896,6390800.0473755365,8746076.673774203,8566721.483029593,155667.89603113374,8746076.673774203,discard
hybrid_medium_cov1.5_cvar1,Add a scaled downside-CVaR overlay while retaining covariance factor risk.,optimal,1051799.6883827597,314097.88573795505,49311.910141532106,688389.8925032725,3860787.1200073534,5598993.964750992,8083142.625457263,0.578125,0.6969696969696969,1.3639828007924957,44.80646145882462,6.0,1.0,1.0,1.0,11.957791439564815,688389.8925032726,4210088.027047351,-6404104.538901221,872736.431272594,7255546.886595656,0.5892,6407466.306556535,8743970.833137618,8572296.886372298,154991.5129936165,8743970.833137618,discard
medium_event_liquidity,Use a moderate data-driven rise in forecast event liquidity instead of a schedule rule.,optimal,1044205.6393253716,280070.45165041595,49106.41211550066,715028.775559455,3674328.7331382693,5889238.471480756,8256136.055587726,0.59375,0.5878787878787878,1.8067759381306787,39.44273782534431,6.0,1.0,1.0,1.0,2.8521645798852875,715028.7755594547,4043349.0950237717,-5982799.81550466,886494.2695782826,6927236.806607079,0.5946,5994510.528245683,8412566.439016959,8237015.946893392,139143.83807551317,8412566.439016959,keep
strong_event_liquidity,Stress-test a strong rise in forecast event liquidity and measure the alpha sacrificed.,optimal,1019124.7073494627,260724.99708175054,48781.17124718887,709618.5390205233,3568419.5305125485,5740539.652786638,8033384.947312162,0.58984375,0.6848484848484848,2.6951338141609944,33.63571072985609,6.0,1.0,1.0,1.0,2.767035246956967,709618.5390205233,3923192.957241786,-5838426.816085245,873099.1571704204,6762765.10967991,0.594,5845085.067388591,8157491.705920191,7989922.646754259,133244.7115570919,8157491.705920191,keep
